id,topic,content,tags
1,What are the Business hours,"We’re open most weekdays with weekend hours. Check the top of the page for today’s hours.",hours,location
2,Where can I park,"Street parking is available nearby. Arrive 5–10 minutes early during peak times.",parking,location
3,booking,"You can book online using the Book button, or call us directly for same-day availability.",booking,contact
4,pricing,"We keep pricing transparent. Ask the front desk for current rates or message us from the contact page.",pricing,services
5,reviews,"We embed review highlights on the homepage. You can also view our full profile on Google.",reviews,trust
6,call,"You can reach us at (555) 201-0001 during business hours for any questions or assistance.",contact,phone